{
  "$schema": "http://json-schema.org/draft-07/schema#",
  "$id": "https://learning-passport.example/profiles/ob3-vc2-subset-v1",
  "title": "Learning Passport application subset of Open Badges 3.0 / VC 2.0 (not official certification schema)",
  "type": "object",
  "required": [
    "@context",
    "id",
    "type",
    "issuer",
    "validFrom",
    "credentialSubject"
  ],
  "properties": {
    "@context": {
      "type": "array",
      "minItems": 2,
      "items": [
        {
          "const": "https://www.w3.org/ns/credentials/v2"
        },
        {
          "const": "https://purl.imsglobal.org/spec/ob/v3p0/context-3.0.3.json"
        }
      ]
    },
    "id": {
      "$ref": "#/$defs/uri"
    },
    "type": {
      "type": "array",
      "items": {
        "type": "string"
      },
      "allOf": [
        {
          "contains": {
            "const": "VerifiableCredential"
          }
        },
        {
          "contains": {
            "enum": [
              "OpenBadgeCredential",
              "AchievementCredential"
            ]
          }
        }
      ]
    },
    "issuer": {
      "anyOf": [
        {
          "$ref": "#/$defs/uri"
        },
        {
          "type": "object",
          "required": [
            "id"
          ],
          "properties": {
            "id": {
              "$ref": "#/$defs/uri"
            }
          }
        }
      ]
    },
    "validFrom": {
      "$ref": "#/$defs/dateTime"
    },
    "validUntil": {
      "$ref": "#/$defs/dateTime"
    },
    "awardedDate": {
      "$ref": "#/$defs/dateTime"
    },
    "name": {
      "type": "string",
      "minLength": 1
    },
    "credentialSubject": {
      "type": "object",
      "required": [
        "id",
        "type",
        "achievement"
      ],
      "properties": {
        "id": {
          "$ref": "#/$defs/uri"
        },
        "type": {
          "type": "array",
          "items": {
            "type": "string"
          },
          "contains": {
            "const": "AchievementSubject"
          }
        },
        "name": {
          "type": "string",
          "minLength": 1
        },
        "activityEndDate": {
          "type": "string",
          "pattern": "^\\d{4}-\\d{2}-\\d{2}$"
        },
        "achievement": {
          "type": "object",
          "required": [
            "id",
            "type",
            "name",
            "description",
            "criteria"
          ],
          "properties": {
            "id": {
              "$ref": "#/$defs/uri"
            },
            "type": {
              "type": "array",
              "items": {
                "type": "string"
              },
              "contains": {
                "const": "Achievement"
              }
            },
            "name": {
              "type": "string",
              "minLength": 1
            },
            "description": {
              "type": "string",
              "minLength": 1
            },
            "humanCode": {
              "type": "string",
              "minLength": 1
            },
            "criteria": {
              "type": "object",
              "anyOf": [
                {
                  "required": [
                    "id"
                  ]
                },
                {
                  "required": [
                    "narrative"
                  ]
                }
              ],
              "properties": {
                "id": {
                  "$ref": "#/$defs/uri"
                },
                "narrative": {
                  "type": "string",
                  "minLength": 1
                }
              }
            }
          }
        }
      }
    }
  },
  "$defs": {
    "uri": {
      "type": "string",
      "pattern": "^[A-Za-z][A-Za-z0-9+.-]*:\\S+$"
    },
    "dateTime": {
      "type": "string",
      "pattern": "^\\d{4}-\\d{2}-\\d{2}T\\d{2}:\\d{2}:\\d{2}(?:\\.\\d+)?Z$"
    }
  }
}
